"Holland A.E., Byrne M.E., Hepinstall-Cymerman J., Bryan A.L., Devault T.L., Rhodes O.E., Jr, Beasley J.C.",Evidence of niche differentiation for two sympatric vulture species in the Southeastern United States,2019,10.1186/s40462-019-0179-z,https://www.scopus.com/inward/record.uri?eid=2-s2.0-85075619439&doi=10.1186%2fs40462-019-0179-z&partnerID=40&md5=4ea68f0bd0393f9b226f7eaa5b44959d,"Warnell School of Forestry and Natural Resources, University of Georgia, Athens, GA, United States; Savannah River Ecology Laboratory, University of Georgia, Aiken, SC, United States; School of Natural Resources, University of Missouri, Columbia, MO, United States; USDA/APHIS/WS National Wildlife Research Center, Sandusky, OH, United States; Odum School of Ecology, University of Georgia, Athens, GA, United States","Holland, A.E., Warnell School of Forestry and Natural Resources, University of Georgia, Athens, GA, United States, Savannah River Ecology Laboratory, University of Georgia, Aiken, SC, United States; Byrne, M.E., Savannah River Ecology Laboratory, University of Georgia, Aiken, SC, United States, School of Natural Resources, University of Missouri, Columbia, MO, United States; Hepinstall-Cymerman, J., Warnell School of Forestry and Natural Resources, University of Georgia, Athens, GA, United States; Bryan, A.L., Savannah River Ecology Laboratory, University of Georgia, Aiken, SC, United States; Devault, T.L., USDA/APHIS/WS National Wildlife Research Center, Sandusky, OH, United States; Rhodes, O.E., Jr, Savannah River Ecology Laboratory, University of Georgia, Aiken, SC, United States, Odum School of Ecology, University of Georgia, Athens, GA, United States; Beasley, J.C., Warnell School of Forestry and Natural Resources, University of Georgia, Athens, GA, United States, Savannah River Ecology Laboratory, University of Georgia, Aiken, SC, United States","Beasley, J.C.; Warnell School of Forestry and Natural Resources, United States; email: beasley@srel.uga.edu", ,187,United States,North_America,High,United States,,Y,,United States,North_America,High,,,,,,,,,Edward Hurme
"Brust V., Michalik B., Hüppop O.",To cross or not to cross - Thrushes at the German North Sea coast adapt flight and routing to wind conditions in autumn,2019,10.1186/s40462-019-0173-5,https://www.scopus.com/inward/record.uri?eid=2-s2.0-85074635443&doi=10.1186%2fs40462-019-0173-5&partnerID=40&md5=f8ee9c47ef7e134d6d6e54b28b6f7fae,"Institute of Avian Research, An der Vogelwarte 21, Wilhelmshaven, 26386, Germany","Brust, V., Institute of Avian Research, An der Vogelwarte 21, Wilhelmshaven, 26386, Germany; Michalik, B., Institute of Avian Research, An der Vogelwarte 21, Wilhelmshaven, 26386, Germany; Hüppop, O., Institute of Avian Research, An der Vogelwarte 21, Wilhelmshaven, 26386, Germany","Hüppop, O.; Institute of Avian Research, An der Vogelwarte 21, Germany; email: ommo.hueppop@ifv-vogelwarte.de", ,188,Germany,Europe_Central_Asia,High,Germany,,Y,,Germany,Europe_Central_Asia,High,,,,,,,,,Edward Hurme
"St. John Glew K., Wanless S., Harris M.P., Daunt F., Erikstad K.E., Strøm H., Speakman J.R., Kürten B., Trueman C.N.",Sympatric Atlantic puffins and razorbills show contrasting responses to adverse marine conditions during winter foraging within the North Sea,2019,10.1186/s40462-019-0174-4,https://www.scopus.com/inward/record.uri?eid=2-s2.0-85074489096&doi=10.1186%2fs40462-019-0174-4&partnerID=40&md5=63f0a108604eee9c3022fae7aedc8c66,"Department of Ocean and Earth Science, University of Southampton, Waterfront Campus, Southampton, SO143ZH, United Kingdom; Centre for Ecology and Hydrology, Bush Estate, Penicuik, EH260QB, United Kingdom; Norwegian Institute for Nature Research, Fram Centre, Tromsø, N-9296, Norway; Norwegian University of Science and Technology (NTNU), Centre for Biodiversity Dynamics, Department of Biology, Trondheim, N-7491, Norway; Norwegian Polar Institute, Fram Centre Langnes, Postbox 6606, Tromsø, NO-9296, Norway; Institute of Genetics and Developmental Biology, Chinese Academy of Sciences, Beijing, China; Institute of Biological and Environmental Sciences, University of Aberdeen, Aberdeen, United Kingdom; School of Natural and Environmental Sciences, University of Newcastle, Newcastle-upon-Tyne, NE17RU, United Kingdom; King Abdullah University of Science and Technology (KAUST), Red Sea Research Center (RSRC), Biological and Environmental Sciences and Engineering Division (BESE), Thuwal, 23955-6900, Saudi Arabia","St. John Glew, K., Department of Ocean and Earth Science, University of Southampton, Waterfront Campus, Southampton, SO143ZH, United Kingdom; Wanless, S., Centre for Ecology and Hydrology, Bush Estate, Penicuik, EH260QB, United Kingdom; Harris, M.P., Centre for Ecology and Hydrology, Bush Estate, Penicuik, EH260QB, United Kingdom; Daunt, F., Centre for Ecology and Hydrology, Bush Estate, Penicuik, EH260QB, United Kingdom; Erikstad, K.E., Norwegian Institute for Nature Research, Fram Centre, Tromsø, N-9296, Norway, Norwegian University of Science and Technology (NTNU), Centre for Biodiversity Dynamics, Department of Biology, Trondheim, N-7491, Norway; Strøm, H., Norwegian Polar Institute, Fram Centre Langnes, Postbox 6606, Tromsø, NO-9296, Norway; Speakman, J.R., Institute of Genetics and Developmental Biology, Chinese Academy of Sciences, Beijing, China, Institute of Biological and Environmental Sciences, University of Aberdeen, Aberdeen, United Kingdom; Kürten, B., School of Natural and Environmental Sciences, University of Newcastle, Newcastle-upon-Tyne, NE17RU, United Kingdom, King Abdullah University of Science and Technology (KAUST), Red Sea Research Center (RSRC), Biological and Environmental Sciences and Engineering Division (BESE), Thuwal, 23955-6900, Saudi Arabia; Trueman, C.N., Department of Ocean and Earth Science, University of Southampton, Waterfront Campus, Southampton, SO143ZH, United Kingdom","St. John Glew, K.; Department of Ocean and Earth Science, Waterfront Campus, United Kingdom; email: katie.stjohnglew@soton.ac.uk", ,189,United Kingdom,Europe_Central_Asia,High,United Kingdom,,Y,,United Kingdom,Europe_Central_Asia,High,,,,,,,,,Emanuel Fronhofer
"Seidel D.P., Linklater W.L., Kilian W., Preez P.D., Getz W.M.",Mesoscale movement and recursion behaviors of Namibian black rhinos,2019,10.1186/s40462-019-0176-2,https://www.scopus.com/inward/record.uri?eid=2-s2.0-85074851750&doi=10.1186%2fs40462-019-0176-2&partnerID=40&md5=d94bdcfbd64579e29ff6fc08c3e9a40e,"Department of Environmental Science,Policy, and Management, University of California, Berkeley Mulford Hall, Berkeley, CA, United States; Centre for Biodiversity and Restoration Ecology, Victoria University of Wellington, P.O. Box 600, Wellington, 6140, New Zealand; Centre for African Conservation Ecology, Nelson Mandela University, Port Elizabeth, South Africa; Etosha National Park, PO Box 6, Okaukuejo via Outjo, Namibia; School of Mathematical Sciences, University of KwaZulu-Natal, Durban, South Africa","Seidel, D.P., Department of Environmental Science,Policy, and Management, University of California, Berkeley Mulford Hall, Berkeley, CA, United States; Linklater, W.L., Department of Environmental Science,Policy, and Management, University of California, Berkeley Mulford Hall, Berkeley, CA, United States, Centre for Biodiversity and Restoration Ecology, Victoria University of Wellington, P.O. Box 600, Wellington, 6140, New Zealand, Centre for African Conservation Ecology, Nelson Mandela University, Port Elizabeth, South Africa; Kilian, W., Etosha National Park, PO Box 6, Okaukuejo via Outjo, Namibia; Preez, P.D., Etosha National Park, PO Box 6, Okaukuejo via Outjo, Namibia; Getz, W.M., Department of Environmental Science,Policy, and Management, University of California, Berkeley Mulford Hall, Berkeley, CA, United States, School of Mathematical Sciences, University of KwaZulu-Natal, Durban, South Africa","Seidel, D.P.; Department of Environmental Science,Policy, Berkeley Mulford Hall, United States; email: dpseidel@Berkeley.edu", ,190,United States,North_America,High,United States,,Y,,Namibia,Sub-Saharan_Africa,Upper_Middle,,,,,,,,,Emanuel Fronhofer
"Noonan M.J., Fleming C.H., Akre T.S., Drescher-Lehman J., Gurarie E., Harrison A.-L., Kays R., Calabrese J.M.",Scale-insensitive estimation of speed and distance traveled from animal tracking data,2019,10.1186/s40462-019-0177-1,https://www.scopus.com/inward/record.uri?eid=2-s2.0-85075164286&doi=10.1186%2fs40462-019-0177-1&partnerID=40&md5=38990e8ec16369ee0cf42453c554c679,"Smithsonian Conservation Biology Institute, National Zoological Park, 1500 Remount Rd, Front Royal, 22630, United States; Department of Biology, University of Maryland, College Park, 20742, United States; Department of Biology, George Mason University, 4400 University Drive, Fairfax, 22030, United States; Migratory Bird Center, Smithsonian Conservation Biology Institute, National Zoological Park, Washington, DC  20008, United States; North Carolina Museum of Natural Sciences, Biodiversity Lab, Raleigh, 27601, United States; Department of Forestry and Environmental Resources, North Carolina State University, 4400 University Drive, Raleigh, 27695, United States","Noonan, M.J., Smithsonian Conservation Biology Institute, National Zoological Park, 1500 Remount Rd, Front Royal, 22630, United States, Department of Biology, University of Maryland, College Park, 20742, United States; Fleming, C.H., Smithsonian Conservation Biology Institute, National Zoological Park, 1500 Remount Rd, Front Royal, 22630, United States, Department of Biology, University of Maryland, College Park, 20742, United States; Akre, T.S., Smithsonian Conservation Biology Institute, National Zoological Park, 1500 Remount Rd, Front Royal, 22630, United States; Drescher-Lehman, J., Smithsonian Conservation Biology Institute, National Zoological Park, 1500 Remount Rd, Front Royal, 22630, United States, Department of Biology, George Mason University, 4400 University Drive, Fairfax, 22030, United States; Gurarie, E., Department of Biology, University of Maryland, College Park, 20742, United States; Harrison, A.-L., Migratory Bird Center, Smithsonian Conservation Biology Institute, National Zoological Park, Washington, DC  20008, United States; Kays, R., North Carolina Museum of Natural Sciences, Biodiversity Lab, Raleigh, 27601, United States, Department of Forestry and Environmental Resources, North Carolina State University, 4400 University Drive, Raleigh, 27695, United States; Calabrese, J.M., Smithsonian Conservation Biology Institute, National Zoological Park, 1500 Remount Rd, Front Royal, 22630, United States, Department of Biology, University of Maryland, College Park, 20742, United States","Noonan, M.J.; Smithsonian Conservation Biology Institute, 1500 Remount Rd, United States; email: NoonanM@si.edu", ,191,United States,North_America,High,United States,,N,simulation,,,,,,,,,,,,Emanuel Fronhofer
"Bielčik M., Aguilar-Trigueros C.A., Lakovic M., Jeltsch F., Rillig M.C.",The role of active movement in fungal ecology and community assembly,2019,10.1186/s40462-019-0180-6,https://www.scopus.com/inward/record.uri?eid=2-s2.0-85075565664&doi=10.1186%2fs40462-019-0180-6&partnerID=40&md5=289768003cc76f0d4323d48b4343f153,"Institut für Biologie, Plant Ecology, Freie Universität Berlin, Berlin, 14195, Germany; Berlin-Brandenburg Institute of Advanced Biodiversity Research (BBIB), Berlin, 14195, Germany; Department of Plant Ecology and Nature Conservation, University of Potsdam, Am Mühlenberg 3, Potsdam-Golm, 14476, Germany","Bielčik, M., Institut für Biologie, Plant Ecology, Freie Universität Berlin, Berlin, 14195, Germany, Berlin-Brandenburg Institute of Advanced Biodiversity Research (BBIB), Berlin, 14195, Germany; Aguilar-Trigueros, C.A., Institut für Biologie, Plant Ecology, Freie Universität Berlin, Berlin, 14195, Germany, Berlin-Brandenburg Institute of Advanced Biodiversity Research (BBIB), Berlin, 14195, Germany; Lakovic, M., Institut für Biologie, Plant Ecology, Freie Universität Berlin, Berlin, 14195, Germany, Berlin-Brandenburg Institute of Advanced Biodiversity Research (BBIB), Berlin, 14195, Germany; Jeltsch, F., Berlin-Brandenburg Institute of Advanced Biodiversity Research (BBIB), Berlin, 14195, Germany, Department of Plant Ecology and Nature Conservation, University of Potsdam, Am Mühlenberg 3, Potsdam-Golm, 14476, Germany; Rillig, M.C., Institut für Biologie, Plant Ecology, Freie Universität Berlin, Berlin, 14195, Germany, Berlin-Brandenburg Institute of Advanced Biodiversity Research (BBIB), Berlin, 14195, Germany","Rillig, M.C.; Institut für Biologie, Germany; email: matthias.rillig@fu-berlin.de", ,192,Germany,Europe_Central_Asia,High,Germany,,N,review,,,,,,,,,,,,Emanuel Fronhofer
"Williams S.M., Lindell C.A.",The influence of a single species on the space use of mixed-species flocks in Amazonian Peru,2019,10.1186/s40462-019-0181-5,https://www.scopus.com/inward/record.uri?eid=2-s2.0-85075808831&doi=10.1186%2fs40462-019-0181-5&partnerID=40&md5=c3ab399d14daee54f3c924984455d470,"Department of Integrative Biology, Michigan State University, East Lansing, MI, United States; Program for Ecology Evolutionary Biology, and Behavior, Michigan State University, East Lansing, MI, United States; Department of Biology, College of the Holy Cross, Worcester, MA, United States; Center for Global Change and Earth Observations, Michigan State University, East Lansing, MI, United States","Williams, S.M., Department of Integrative Biology, Michigan State University, East Lansing, MI, United States, Program for Ecology Evolutionary Biology, and Behavior, Michigan State University, East Lansing, MI, United States, Department of Biology, College of the Holy Cross, Worcester, MA, United States; Lindell, C.A., Department of Integrative Biology, Michigan State University, East Lansing, MI, United States, Program for Ecology Evolutionary Biology, and Behavior, Michigan State University, East Lansing, MI, United States, Center for Global Change and Earth Observations, Michigan State University, East Lansing, MI, United States","Williams, S.M.; Department of Integrative Biology, United States; email: seanbirder@gmail.com", ,193,United States,North_America,High,United States,,Y,,Peru,Latin_America_Caribbean,Upper_Middle,,,,,,,,,Emanuel Fronhofer
"French J.T., Wang H.-H., Grant W.E., Tomeček J.M.",Dynamics of animal joint space use: A novel application of a time series approach,2019,10.1186/s40462-019-0183-3,https://www.scopus.com/inward/record.uri?eid=2-s2.0-85076348992&doi=10.1186%2fs40462-019-0183-3&partnerID=40&md5=bd4742779ecaa605d1340d547bc5eee9,"Department of Wildlife and Fisheries Science, Texas AandM University, 534 John Kimbrough Blvd., College Station, 77843, United States","French, J.T., Department of Wildlife and Fisheries Science, Texas AandM University, 534 John Kimbrough Blvd., College Station, 77843, United States; Wang, H.-H., Department of Wildlife and Fisheries Science, Texas AandM University, 534 John Kimbrough Blvd., College Station, 77843, United States; Grant, W.E., Department of Wildlife and Fisheries Science, Texas AandM University, 534 John Kimbrough Blvd., College Station, 77843, United States; Tomeček, J.M., Department of Wildlife and Fisheries Science, Texas AandM University, 534 John Kimbrough Blvd., College Station, 77843, United States","French, J.T.; Department of Wildlife and Fisheries Science, 534 John Kimbrough Blvd., United States; email: jtfrench@tamu.edu", ,194,United States,North_America,High,United States,,Y,,United States,North_America,High,,,,,,,,,Emanuel Fronhofer
"De Guinea M., Estrada A., Nekaris K.A.-I., Van Belle S.",Arboreal route navigation in a Neotropical mammal: Energetic implications associated with tree monitoring and landscape attributes,2019,10.1186/s40462-019-0187-z,https://www.scopus.com/inward/record.uri?eid=2-s2.0-85077091699&doi=10.1186%2fs40462-019-0187-z&partnerID=40&md5=03d14e50949c1758955ac499f3efc69f,"Department of Social Sciences, Oxford Brookes University, Gibbs Building, Gipsy Lane, Oxford, OX3 0BP, United Kingdom; Institute of Biology, National Autonomous University of Mexico, Mexico City, Mexico; Department of Anthropology, University of Texas at Austin, Austin, TX, United States","De Guinea, M., Department of Social Sciences, Oxford Brookes University, Gibbs Building, Gipsy Lane, Oxford, OX3 0BP, United Kingdom; Estrada, A., Institute of Biology, National Autonomous University of Mexico, Mexico City, Mexico; Nekaris, K.A.-I., Department of Social Sciences, Oxford Brookes University, Gibbs Building, Gipsy Lane, Oxford, OX3 0BP, United Kingdom; Van Belle, S., Department of Anthropology, University of Texas at Austin, Austin, TX, United States","De Guinea, M.; Department of Social Sciences, Gipsy Lane, United Kingdom; email: mdeguinea@gmail.com", ,195,United Kingdom,Europe_Central_Asia,High,United Kingdom,,Y,,Mexico,Latin_America_Caribbean,Upper_Middle,,,,,,,,,Emanuel Fronhofer
"Dermond P., Melián C.J., Brodersen J.",Size-dependent tradeoffs in seasonal freshwater environments facilitate differential salmonid migration,2019,10.1186/s40462-019-0185-1,https://www.scopus.com/inward/record.uri?eid=2-s2.0-85077031991&doi=10.1186%2fs40462-019-0185-1&partnerID=40&md5=40585855c942036174fd45927f45e96b,"Department of Fish Ecology and Evolution, EAWAG Swiss Federal Institute of Aquatic Science and Technology, Centre of Ecology, Evolution and Biogeochemistry, Seestrasse 79, Kastanienbaum, CH-6047, Switzerland; Institute of Ecology and Evolution, Aquatic Ecology, University of Bern, Baltzerstrasse 6, Bern, CH-3012, Switzerland","Dermond, P., Department of Fish Ecology and Evolution, EAWAG Swiss Federal Institute of Aquatic Science and Technology, Centre of Ecology, Evolution and Biogeochemistry, Seestrasse 79, Kastanienbaum, CH-6047, Switzerland, Institute of Ecology and Evolution, Aquatic Ecology, University of Bern, Baltzerstrasse 6, Bern, CH-3012, Switzerland; Melián, C.J., Department of Fish Ecology and Evolution, EAWAG Swiss Federal Institute of Aquatic Science and Technology, Centre of Ecology, Evolution and Biogeochemistry, Seestrasse 79, Kastanienbaum, CH-6047, Switzerland, Institute of Ecology and Evolution, Aquatic Ecology, University of Bern, Baltzerstrasse 6, Bern, CH-3012, Switzerland; Brodersen, J., Department of Fish Ecology and Evolution, EAWAG Swiss Federal Institute of Aquatic Science and Technology, Centre of Ecology, Evolution and Biogeochemistry, Seestrasse 79, Kastanienbaum, CH-6047, Switzerland, Institute of Ecology and Evolution, Aquatic Ecology, University of Bern, Baltzerstrasse 6, Bern, CH-3012, Switzerland","Dermond, P.; Department of Fish Ecology and Evolution, Seestrasse 79, Switzerland; email: philip.dermond@eawag.ch", ,196,Switzerland,Europe_Central_Asia,High,Switzerland,,Y,,Switzerland,Europe_Central_Asia,High,,,,,,,,,Emanuel Fronhofer
"Sotillo A., Baert J.M., Müller W., Stienen E.W.M., Soares A.M.V.M., Lens L.",Time and energy costs of different foraging choices in an avian generalist species,2019,10.1186/s40462-019-0188-y,https://www.scopus.com/inward/record.uri?eid=2-s2.0-85077237505&doi=10.1186%2fs40462-019-0188-y&partnerID=40&md5=8bb99da40768c70e9539c74455f3f410,"Department of Biology, Terrestrial Ecology Unit, Ghent University, K.L. Ledeganckstraat 35, Ghent, 9000, Belgium; Department of Biology, CESAM - Centre for Environmental and Marine Studies, University of Aveiro, Campus de Santiago, Aveiro, 3810-193, Portugal; Department of Biology, Behavioural Ecology and Ecophysiology Group, University of Antwerp, Campus Drie Eiken, Universiteitsplein 1, Wilrijk, Antwerp, 2610, Belgium; Research Institute for Nature and Forest (INBO), Herman Teirlinckgebouw, Havenlaan 88, Brussels, 1000, Belgium","Sotillo, A., Department of Biology, Terrestrial Ecology Unit, Ghent University, K.L. Ledeganckstraat 35, Ghent, 9000, Belgium, Department of Biology, CESAM - Centre for Environmental and Marine Studies, University of Aveiro, Campus de Santiago, Aveiro, 3810-193, Portugal; Baert, J.M., Department of Biology, Terrestrial Ecology Unit, Ghent University, K.L. Ledeganckstraat 35, Ghent, 9000, Belgium, Department of Biology, Behavioural Ecology and Ecophysiology Group, University of Antwerp, Campus Drie Eiken, Universiteitsplein 1, Wilrijk, Antwerp, 2610, Belgium; Müller, W., Department of Biology, Behavioural Ecology and Ecophysiology Group, University of Antwerp, Campus Drie Eiken, Universiteitsplein 1, Wilrijk, Antwerp, 2610, Belgium; Stienen, E.W.M., Research Institute for Nature and Forest (INBO), Herman Teirlinckgebouw, Havenlaan 88, Brussels, 1000, Belgium; Soares, A.M.V.M., Department of Biology, CESAM - Centre for Environmental and Marine Studies, University of Aveiro, Campus de Santiago, Aveiro, 3810-193, Portugal; Lens, L., Department of Biology, Terrestrial Ecology Unit, Ghent University, K.L. Ledeganckstraat 35, Ghent, 9000, Belgium","Sotillo, A.; Department of Biology, K.L. Ledeganckstraat 35, Belgium; email: alejandro.sotillogonzales@ugent.be", ,197,Belgium,Europe_Central_Asia,High,Belgium,,Y,,Belgium,Europe_Central_Asia,High,,,,,,,,,Emanuel Fronhofer
"Wolz M., Klockmann M., Schmitz T., Pekár S., Bonte D., Uhl G.",Dispersal and life-history traits in a spider with rapid range expansion,2020,10.1186/s40462-019-0182-4,https://www.scopus.com/inward/record.uri?eid=2-s2.0-85077876355&doi=10.1186%2fs40462-019-0182-4&partnerID=40&md5=98cd068352d4eb6e46c866842ae81dad,"Zoological Institute and Museum, General and Systematic Zoology, University of Greifswald, Greifswald, Germany; Masaryk University, Brno, Czech Republic; Ghent University, Ghent, Belgium","Wolz, M., Zoological Institute and Museum, General and Systematic Zoology, University of Greifswald, Greifswald, Germany; Klockmann, M., Zoological Institute and Museum, General and Systematic Zoology, University of Greifswald, Greifswald, Germany; Schmitz, T., Zoological Institute and Museum, General and Systematic Zoology, University of Greifswald, Greifswald, Germany; Pekár, S., Masaryk University, Brno, Czech Republic; Bonte, D., Ghent University, Ghent, Belgium; Uhl, G., Zoological Institute and Museum, General and Systematic Zoology, University of Greifswald, Greifswald, Germany","Uhl, G.; Zoological Institute and Museum, Germany; email: gabriele.uhl@uni-greifswald.de", ,198,Germany,Europe_Central_Asia,High,Germany,,Y,,France,Europe_Central_Asia,High,,,,,,,,,Emanuel Fronhofer
"Chambault P., Dalleau M., Nicet J.-B., Mouquet P., Ballorain K., Jean C., Ciccione S., Bourjea J.",Contrasted habitats and individual plasticity drive the fine scale movements of juvenile green turtles in coastal ecosystems,2020,10.1186/s40462-019-0184-2,https://www.scopus.com/inward/record.uri?eid=2-s2.0-85077900045&doi=10.1186%2fs40462-019-0184-2&partnerID=40&md5=c4f62dd490697e6a7b6e4a7cc90bef71,"UMR MARBEC, IFREMER, CNRS, IRD, University of Montpellier, Avenue Jean Monnet, Sète, 34200, France; Centre d'Etude et de Découverte des Tortues Marines (CEDTM), 6 chemin Dubuisson, Appt. 5, Saint-Leu, La Réunion, 97436, France; GIE MAREX, 697 Chemin Surprise, La Fontaine, Saint Leu, La Réunion, 97436, France; Université de la Réunion/UMR ESPACE-DEV, Antenne SEAS-OI, 40 Avenue de Soweto, Saint-Pierre, La Réunion, 97410, France; Biodiversity French Agency, Mayotte and Glorieuses Marine Nature Parks, 6 chemin Dubuisson, Appt. 5, Saint-Leu, La Réunion, 97436, France; Kelonia l'Observatoire des Tortues Marines, 46 rue du Général de Gaulle, Saint Leu, La Réunion, 97436, France","Chambault, P., UMR MARBEC, IFREMER, CNRS, IRD, University of Montpellier, Avenue Jean Monnet, Sète, 34200, France; Dalleau, M., Centre d'Etude et de Découverte des Tortues Marines (CEDTM), 6 chemin Dubuisson, Appt. 5, Saint-Leu, La Réunion, 97436, France; Nicet, J.-B., GIE MAREX, 697 Chemin Surprise, La Fontaine, Saint Leu, La Réunion, 97436, France; Mouquet, P., Université de la Réunion/UMR ESPACE-DEV, Antenne SEAS-OI, 40 Avenue de Soweto, Saint-Pierre, La Réunion, 97410, France; Ballorain, K., Centre d'Etude et de Découverte des Tortues Marines (CEDTM), 6 chemin Dubuisson, Appt. 5, Saint-Leu, La Réunion, 97436, France, Biodiversity French Agency, Mayotte and Glorieuses Marine Nature Parks, 6 chemin Dubuisson, Appt. 5, Saint-Leu, La Réunion, 97436, France; Jean, C., Kelonia l'Observatoire des Tortues Marines, 46 rue du Général de Gaulle, Saint Leu, La Réunion, 97436, France; Ciccione, S., Kelonia l'Observatoire des Tortues Marines, 46 rue du Général de Gaulle, Saint Leu, La Réunion, 97436, France; Bourjea, J., UMR MARBEC, IFREMER, CNRS, IRD, University of Montpellier, Avenue Jean Monnet, Sète, 34200, France","Chambault, P.; UMR MARBEC, Avenue Jean Monnet, France; email: philippine.chambault@gmail.com", ,199,France,Europe_Central_Asia,High,France,,Y,,France,Europe_Central_Asia,High,,,,,,,,,Emanuel Fronhofer
