"Péron G., Fleming C.H., de Paula R.C., Calabrese J.M.","Uncovering periodic patterns of space use in animal tracking data with periodograms, including a new algorithm for the Lomb-Scargle periodogram and improved randomization tests",2016,10.1186/s40462-016-0084-7,https://www.scopus.com/inward/record.uri?eid=2-s2.0-84979701189&doi=10.1186%2fs40462-016-0084-7&partnerID=40&md5=05246e1415a999c407b5d83852d467f4,"Smithsonian Conservation Biology Institute, National Zoological Park, Front Royal, VA  22630, United States; University of Maryland, Department of Biology, College Park, MD  20742, United States; National Research Center for Carnivore Conservation (CENAP/ICMBio), Atibaia, Sao Paulo, Brazil","Péron, G., Smithsonian Conservation Biology Institute, National Zoological Park, Front Royal, VA  22630, United States; Fleming, C.H., Smithsonian Conservation Biology Institute, National Zoological Park, Front Royal, VA  22630, United States, University of Maryland, Department of Biology, College Park, MD  20742, United States; de Paula, R.C., National Research Center for Carnivore Conservation (CENAP/ICMBio), Atibaia, Sao Paulo, Brazil; Calabrese, J.M., Smithsonian Conservation Biology Institute, National Zoological Park, Front Royal, VA  22630, United States, University of Maryland, Department of Biology, College Park, MD  20742, United States","Péron, G.; Smithsonian Conservation Biology Institute, United States; email: peron_guillaume@yahoo.fr", ,96,United States,North_America,High,United States,,N,mainly simluated data and some previously published data,,,,,,,,,,,,Arne Hegemann
"Maggini I., Metzger B., Voss M., Voigt C.C., Bairlein F.",Morphometrics and stable isotopes differentiate wintering populations of a migratory bird,2016,10.1186/s40462-016-0085-6,https://www.scopus.com/inward/record.uri?eid=2-s2.0-84980319899&doi=10.1186%2fs40462-016-0085-6&partnerID=40&md5=e8297a8654ada3cf8dff0e1da89c8507,"Institute of Avian Research Vogelwarte Helgoland, Wilhelmshaven, Germany; Konrad-Lorenz Institute of Ethology, University of Veterinary Medicine, Vienna, Austria; BirdLife Malta, Xemxija, Malta; Leibniz-Institute of Baltic Sea Research Warnemünde, IOW, Rostock, Germany; Leibniz Institute for Zoo and Wildlife Research, Berlin, Germany","Maggini, I., Institute of Avian Research Vogelwarte Helgoland, Wilhelmshaven, Germany, Konrad-Lorenz Institute of Ethology, University of Veterinary Medicine, Vienna, Austria; Metzger, B., Institute of Avian Research Vogelwarte Helgoland, Wilhelmshaven, Germany, BirdLife Malta, Xemxija, Malta; Voss, M., Leibniz-Institute of Baltic Sea Research Warnemünde, IOW, Rostock, Germany; Voigt, C.C., Leibniz Institute for Zoo and Wildlife Research, Berlin, Germany; Bairlein, F., Institute of Avian Research Vogelwarte Helgoland, Wilhelmshaven, Germany","Maggini, I.; Institute of Avian Research Vogelwarte HelgolandGermany; email: ivan.maggini@vetmeduni.ac.at", ,97,Germany,Europe_Central_Asia,High,Germany,,Y,,Mauritania,Sub-Saharan_Africa,Lower_Middle,Mali,Niger,Kenya,,,,,,Arne Hegemann
"Edelhoff H., Signer J., Balkenhol N.",Path segmentation for beginners: An overview of current methods for detecting changes in animal movement patterns,2016,10.1186/s40462-016-0086-5,https://www.scopus.com/inward/record.uri?eid=2-s2.0-85032068523&doi=10.1186%2fs40462-016-0086-5&partnerID=40&md5=8eb90878f8613a40d4f615ddacedb5f5,"University of Göttingen, Department of Wildlife Sciences, Büsgenweg 3, Göttingen, 37077, Germany","Edelhoff, H., University of Göttingen, Department of Wildlife Sciences, Büsgenweg 3, Göttingen, 37077, Germany; Signer, J., University of Göttingen, Department of Wildlife Sciences, Büsgenweg 3, Göttingen, 37077, Germany; Balkenhol, N., University of Göttingen, Department of Wildlife Sciences, Büsgenweg 3, Göttingen, 37077, Germany","Edelhoff, H.; University of Göttingen, Büsgenweg 3, Germany; email: hendrik.edelhoff@gmail.com", ,98,Germany,Europe_Central_Asia,High,Germany,,N,no data,,,,,,,,,,,,Arne Hegemann
"Wilson R.P., Holton M.D., Walker J.S., Shepard E.L.C., Scantlebury D.M., Wilson V.L., Wilson G.I., Tysse B., Gravenor M., Ciancio J., McNarry M.A., Mackintosh K.A., Qasem L., Rosell F., Graf P.M., Quintana F., Gomez-Laich A., Sala J.-E., Mulvenna C.C., Marks N.J., Jones M.W.","A spherical-plot solution to linking acceleration metrics with animal performance, state, behaviour and lifestyle",2016,10.1186/s40462-016-0088-3,https://www.scopus.com/inward/record.uri?eid=2-s2.0-84992089264&doi=10.1186%2fs40462-016-0088-3&partnerID=40&md5=5d5f65e2bb5057187fb48528cc69bece,"Swansea University, Swansea Lab for Animal Movement, Biosciences, College of Science, Singleton Park, Swansea, SA2 8PP, United Kingdom; Swansea University, Visual Computing, Computer Science, College of Science, Singleton Park, Swansea, SA2 8PP, United Kingdom; Institute for Global Food Security, Queen's University Belfast, Medical Biology Centre, School of Biological Sciences, 97, Lisburn Road, Belfast, BT9 7BL, United Kingdom; Institute of Life Science, Swansea University Medical School, Swansea, SA2 8PP, United Kingdom; Centro Nacional Patagonico, Boulevard Brown s/n, Chubut, Argentina; Swansea University, Applied Sports Science Technology and Medicine Research Centre, College of Engineering, Fabian Way, Swansea, SA1 8EN, United Kingdom; Qatar University, Department of Biological and Environmental Sciences, College of Arts and Sciences, Doha, 2713, Qatar; Telemark University College, Faculty of Arts and Sciences, Department of Environmental and Health Studies, N-3800 Bø i, Telemark, Norway; Institute of Wildlife Biology and Game Management, University of Natural Resources and Life Sciences, Department of Integrative Biology and Biodiversity Research, Vienna, Vienna, A-1180, Austria","Wilson, R.P., Swansea University, Swansea Lab for Animal Movement, Biosciences, College of Science, Singleton Park, Swansea, SA2 8PP, United Kingdom; Holton, M.D., Swansea University, Visual Computing, Computer Science, College of Science, Singleton Park, Swansea, SA2 8PP, United Kingdom; Walker, J.S., Swansea University, Visual Computing, Computer Science, College of Science, Singleton Park, Swansea, SA2 8PP, United Kingdom; Shepard, E.L.C., Swansea University, Swansea Lab for Animal Movement, Biosciences, College of Science, Singleton Park, Swansea, SA2 8PP, United Kingdom; Scantlebury, D.M., Institute for Global Food Security, Queen's University Belfast, Medical Biology Centre, School of Biological Sciences, 97, Lisburn Road, Belfast, BT9 7BL, United Kingdom; Wilson, V.L., Swansea University, Swansea Lab for Animal Movement, Biosciences, College of Science, Singleton Park, Swansea, SA2 8PP, United Kingdom; Wilson, G.I., Swansea University, Swansea Lab for Animal Movement, Biosciences, College of Science, Singleton Park, Swansea, SA2 8PP, United Kingdom; Tysse, B., Swansea University, Swansea Lab for Animal Movement, Biosciences, College of Science, Singleton Park, Swansea, SA2 8PP, United Kingdom; Gravenor, M., Institute of Life Science, Swansea University Medical School, Swansea, SA2 8PP, United Kingdom; Ciancio, J., Centro Nacional Patagonico, Boulevard Brown s/n, Chubut, Argentina; McNarry, M.A., Swansea University, Applied Sports Science Technology and Medicine Research Centre, College of Engineering, Fabian Way, Swansea, SA1 8EN, United Kingdom; Mackintosh, K.A., Swansea University, Applied Sports Science Technology and Medicine Research Centre, College of Engineering, Fabian Way, Swansea, SA1 8EN, United Kingdom; Qasem, L., Qatar University, Department of Biological and Environmental Sciences, College of Arts and Sciences, Doha, 2713, Qatar; Rosell, F., Telemark University College, Faculty of Arts and Sciences, Department of Environmental and Health Studies, N-3800 Bø i, Telemark, Norway; Graf, P.M., Telemark University College, Faculty of Arts and Sciences, Department of Environmental and Health Studies, N-3800 Bø i, Telemark, Norway, Institute of Wildlife Biology and Game Management, University of Natural Resources and Life Sciences, Department of Integrative Biology and Biodiversity Research, Vienna, Vienna, A-1180, Austria; Quintana, F., Centro Nacional Patagonico, Boulevard Brown s/n, Chubut, Argentina; Gomez-Laich, A., Centro Nacional Patagonico, Boulevard Brown s/n, Chubut, Argentina; Sala, J.-E., Centro Nacional Patagonico, Boulevard Brown s/n, Chubut, Argentina; Mulvenna, C.C., Institute for Global Food Security, Queen's University Belfast, Medical Biology Centre, School of Biological Sciences, 97, Lisburn Road, Belfast, BT9 7BL, United Kingdom; Marks, N.J., Institute for Global Food Security, Queen's University Belfast, Medical Biology Centre, School of Biological Sciences, 97, Lisburn Road, Belfast, BT9 7BL, United Kingdom; Jones, M.W., Swansea University, Visual Computing, Computer Science, College of Science, Singleton Park, Swansea, SA2 8PP, United Kingdom","Wilson, R.P.; Swansea University, Singleton Park, United Kingdom; email: r.p.wilson@swansea.ac.uk", ,99,United Kingdom,Europe_Central_Asia,High,United Kingdom,,N,No original data,No original data,,,penguin/argentina,beaver/Northern Ireland,,,,,,,Nilanjan Chatterjee
"Briscoe D.K., Parker D.M., Bograd S., Hazen E., Scales K., Balazs G.H., Kurita M., Saito T., Okamoto H., Rice M., Polovina J.J., Crowder L.B.",Multi-year tracking reveals extensive pelagic phase of juvenile loggerhead sea turtles in the North Pacific,2016,10.1186/s40462-016-0087-4,https://www.scopus.com/inward/record.uri?eid=2-s2.0-84989352664&doi=10.1186%2fs40462-016-0087-4&partnerID=40&md5=9d92491e64e75770d2f7b3e9e1afbf95,"Stanford University, Hopkins Marine Station, Pacific Grove, CA, United States; National Oceanic and Atmospheric Administration, Joint Institute for Marine and Atmospheric Research, Newport, OR, United States; Southwest Fisheries Science Center, Environmental Research Division, National Marine Fisheries Service, National Oceanic and Atmospheric Administration, Monterey, CA, United States; Pacific Islands Fisheries Science Center, National Marine Fisheries Service, National Oceanic and Atmospheric Administration, Honolulu, HI, United States; Port of Nagoya Public Aquarium, Minato-ku, Nagoya, 455-0033, Japan; Kochi University, Usa Marine Biological Institute, Usa Tosa, Kochi, 781-1164, Japan; Hawaii Preparatory Academy, 65-1692 Kohala Mt. Rd. Kamuela, Hawaii, 96743, United States; Stanford University, Center for Ocean Solutions, Monterey, CA, United States","Briscoe, D.K., Stanford University, Hopkins Marine Station, Pacific Grove, CA, United States; Parker, D.M., National Oceanic and Atmospheric Administration, Joint Institute for Marine and Atmospheric Research, Newport, OR, United States; Bograd, S., Southwest Fisheries Science Center, Environmental Research Division, National Marine Fisheries Service, National Oceanic and Atmospheric Administration, Monterey, CA, United States; Hazen, E., Southwest Fisheries Science Center, Environmental Research Division, National Marine Fisheries Service, National Oceanic and Atmospheric Administration, Monterey, CA, United States; Scales, K., Southwest Fisheries Science Center, Environmental Research Division, National Marine Fisheries Service, National Oceanic and Atmospheric Administration, Monterey, CA, United States; Balazs, G.H., Pacific Islands Fisheries Science Center, National Marine Fisheries Service, National Oceanic and Atmospheric Administration, Honolulu, HI, United States; Kurita, M., Port of Nagoya Public Aquarium, Minato-ku, Nagoya, 455-0033, Japan; Saito, T., Kochi University, Usa Marine Biological Institute, Usa Tosa, Kochi, 781-1164, Japan; Okamoto, H., Port of Nagoya Public Aquarium, Minato-ku, Nagoya, 455-0033, Japan; Rice, M., Hawaii Preparatory Academy, 65-1692 Kohala Mt. Rd. Kamuela, Hawaii, 96743, United States; Polovina, J.J., Pacific Islands Fisheries Science Center, National Marine Fisheries Service, National Oceanic and Atmospheric Administration, Honolulu, HI, United States; Crowder, L.B., Stanford University, Hopkins Marine Station, Pacific Grove, CA, United States, Stanford University, Center for Ocean Solutions, Monterey, CA, United States","Briscoe, D.K.; Stanford University, United States; email: dbriscoe@stanford.edu", ,100,United States,North_America,High,United States,,Y,,Japan,East_Asia_Pacific,High,,,,,,,,,Nilanjan Chatterjee
"Müller F., Taylor P.D., Sjöberg S., Muheim R., Tsvey A., Mackenzie S.A., Schmaljohann H.",Towards a conceptual framework for explaining variation in nocturnal departure time of songbird migrants,2016,10.1186/s40462-016-0089-2,https://www.scopus.com/inward/record.uri?eid=2-s2.0-84992135515&doi=10.1186%2fs40462-016-0089-2&partnerID=40&md5=9479bf5909b47aedfcd0b6d2a65e6050,"Institute of Avian Research Vogelwarte Helgoland, An der Vogelwarte 21, Wilhelmshaven, 26386, Germany; Department of Biology, Acadia University, 33 Westwood Avenue, Wolfville, NS  B4P 2R6, Canada; Bird Studies Canada, 115 Front Street, Port Rowan, ON  N0E 1M0, Canada; Lund University, Department of Biology, Biology Building, Sölvegatan 35, Lund, 223 62, Sweden; Biological Station Rybachy, Zoological Institute RAS, Rybachy, Kaliningrad region, RU-238535, Russian Federation","Müller, F., Institute of Avian Research Vogelwarte Helgoland, An der Vogelwarte 21, Wilhelmshaven, 26386, Germany; Taylor, P.D., Department of Biology, Acadia University, 33 Westwood Avenue, Wolfville, NS  B4P 2R6, Canada, Bird Studies Canada, 115 Front Street, Port Rowan, ON  N0E 1M0, Canada; Sjöberg, S., Lund University, Department of Biology, Biology Building, Sölvegatan 35, Lund, 223 62, Sweden; Muheim, R., Lund University, Department of Biology, Biology Building, Sölvegatan 35, Lund, 223 62, Sweden; Tsvey, A., Biological Station Rybachy, Zoological Institute RAS, Rybachy, Kaliningrad region, RU-238535, Russian Federation; Mackenzie, S.A., Bird Studies Canada, 115 Front Street, Port Rowan, ON  N0E 1M0, Canada; Schmaljohann, H., Institute of Avian Research Vogelwarte Helgoland, An der Vogelwarte 21, Wilhelmshaven, 26386, Germany","Müller, F.; Institute of Avian Research Vogelwarte Helgoland, An der Vogelwarte 21, Germany; email: florian.mueller@ifv-vogelwarte.de", ,101,Germany,Europe_Central_Asia,High,Germany,,N,Review,Review,,,,,,,,,,,Nilanjan Chatterjee
"Carter M.I.D., Bennett K.A., Embling C.B., Hosegood P.J., Russell D.J.F.",Navigating uncertain waters: A critical review of inferring foraging behaviour from location and dive data in pinnipeds,2016,10.1186/s40462-016-0090-9,https://www.scopus.com/inward/record.uri?eid=2-s2.0-84992344990&doi=10.1186%2fs40462-016-0090-9&partnerID=40&md5=5eb4b5f7e059b9b18cc5df38a48b7511,"Plymouth University, Marine Biology and Ecology Research Centre, School of Marine Science and Engineering, Plymouth, PL4 8AA, United Kingdom; Abertay University, School of Science, Engineering and Technology, Dundee, DD1 1HG, United Kingdom; Plymouth University, Centre for Coast and Ocean Science and Engineering, School of Marine Science and Engineering, Plymouth, PL4 8AA, United Kingdom; University of St. Andrews, Sea Mammal Research Unit, St. Andrews, KY16 8LB, United Kingdom; University of St. Andrews, Centre for Research into Ecological and Environmental Modelling, St. Andrews, KY16 9LZ, United Kingdom","Carter, M.I.D., Plymouth University, Marine Biology and Ecology Research Centre, School of Marine Science and Engineering, Plymouth, PL4 8AA, United Kingdom; Bennett, K.A., Abertay University, School of Science, Engineering and Technology, Dundee, DD1 1HG, United Kingdom; Embling, C.B., Plymouth University, Marine Biology and Ecology Research Centre, School of Marine Science and Engineering, Plymouth, PL4 8AA, United Kingdom; Hosegood, P.J., Plymouth University, Centre for Coast and Ocean Science and Engineering, School of Marine Science and Engineering, Plymouth, PL4 8AA, United Kingdom; Russell, D.J.F., University of St. Andrews, Sea Mammal Research Unit, St. Andrews, KY16 8LB, United Kingdom, University of St. Andrews, Centre for Research into Ecological and Environmental Modelling, St. Andrews, KY16 9LZ, United Kingdom","Carter, M.I.D.; Plymouth University, United Kingdom; email: matthew.carter@plymouth.ac.uk", ,102,United Kingdom,Europe_Central_Asia,High,United Kingdom,,N,Review,Review,,,,,,,,,,,Nilanjan Chatterjee
"Merkel B., Phillips R.A., Descamps S., Yoccoz N.G., Moe B., Strøm H.",A probabilistic algorithm to process geolocation data,2016,10.1186/s40462-016-0091-8,https://www.scopus.com/inward/record.uri?eid=2-s2.0-84996844969&doi=10.1186%2fs40462-016-0091-8&partnerID=40&md5=be61ba2062c4584a71ac17724852bdb3,"Norwegian Polar Institute, Fram Centre, Langnes, P.O. Box 6606, Tromsø, NO-9296, Norway; UiT The Arctic University of Norway, Department of Arctic and Marine Biology, Tromsø, NO-9037, Norway; British Antarctic Survey, Natural Environment Research Council, High Cross, Madingley Road, Cambridge, CB3 0ET, United Kingdom; Norwegian Institute for Nature Research, Sluppen, P.O. Box 5685, Trondheim, NO-7485, Norway","Merkel, B., Norwegian Polar Institute, Fram Centre, Langnes, P.O. Box 6606, Tromsø, NO-9296, Norway, UiT The Arctic University of Norway, Department of Arctic and Marine Biology, Tromsø, NO-9037, Norway; Phillips, R.A., British Antarctic Survey, Natural Environment Research Council, High Cross, Madingley Road, Cambridge, CB3 0ET, United Kingdom; Descamps, S., Norwegian Polar Institute, Fram Centre, Langnes, P.O. Box 6606, Tromsø, NO-9296, Norway; Yoccoz, N.G., UiT The Arctic University of Norway, Department of Arctic and Marine Biology, Tromsø, NO-9037, Norway; Moe, B., Norwegian Institute for Nature Research, Sluppen, P.O. Box 5685, Trondheim, NO-7485, Norway; Strøm, H., Norwegian Polar Institute, Fram Centre, Langnes, P.O. Box 6606, Tromsø, NO-9296, Norway","Merkel, B.; Norwegian Polar Institute, Langnes, P.O. Box 6606, Norway; email: benjamin.merkel@npolar.no", ,103,Norway,Europe_Central_Asia,High,Norway,,Y,,United Kingdom,Europe_Central_Asia,High,,,,,,,,,Nilanjan Chatterjee
"Li M., Bolker B.M.",Incorporating periodic variability in hidden Markov models for animal movement,2017,10.1186/s40462-016-0093-6,https://www.scopus.com/inward/record.uri?eid=2-s2.0-85010403228&doi=10.1186%2fs40462-016-0093-6&partnerID=40&md5=d91cf248aadab5597adfca51b3133b2a,"McMaster University, Department of Biology, 1280 Main St. West, Hamilton, ON  L8S 4K1, Canada; McMaster University, Department of Mathematics and Statistics, 1280 Main St. West, Hamilton, ON  L8S 4K1, Canada","Li, M., McMaster University, Department of Biology, 1280 Main St. West, Hamilton, ON  L8S 4K1, Canada; Bolker, B.M., McMaster University, Department of Biology, 1280 Main St. West, Hamilton, ON  L8S 4K1, Canada, McMaster University, Department of Mathematics and Statistics, 1280 Main St. West, Hamilton, ON  L8S 4K1, Canada","Li, M.; McMaster University, 1280 Main St. West, Canada; email: lim88@mcmaster.ca", ,104,Canada,North_America,High,Canada,,Y,,United States,North_America,High, ,,,,,,,,Nilanjan Chatterjee
"Kleyheeg E., van Dijk J.G.B., Tsopoglou-Gkina D., Woud T.Y., Boonstra D.K., Nolet B.A., Soons M.B.",Movement patterns of a keystone waterbird species are highly predictable from landscape configuration,2017,10.1186/s40462-016-0092-7,https://www.scopus.com/inward/record.uri?eid=2-s2.0-85011286205&doi=10.1186%2fs40462-016-0092-7&partnerID=40&md5=db5cafffd5f542569c3ce52c5f923393,"Utrecht University, Ecology and Biodiversity Group, Department of Biology, Padualaan 8, Utrecht, 3584 CH, Netherlands; Dutch Centre for Avian Migration and Demography, Netherlands Institute of Ecology (NIOO-KNAW), Droevendaalsesteeg 10, Wageningen, 6708 PB, Netherlands; Netherlands Institute of Ecology (NIOO-KNAW), Department of Animal Ecology, Droevendaalsesteeg 10, Wageningen, 6708 PB, Netherlands; University of Cambridge, Department of Zoology, Downing street, Cambridge, CB2 3EJ, United Kingdom; University of Amsterdam, Theoretical and Computational Ecology, Institute for Biodiversity and Ecosystem Dynamics, Amsterdam, Netherlands","Kleyheeg, E., Utrecht University, Ecology and Biodiversity Group, Department of Biology, Padualaan 8, Utrecht, 3584 CH, Netherlands, Dutch Centre for Avian Migration and Demography, Netherlands Institute of Ecology (NIOO-KNAW), Droevendaalsesteeg 10, Wageningen, 6708 PB, Netherlands; van Dijk, J.G.B., Netherlands Institute of Ecology (NIOO-KNAW), Department of Animal Ecology, Droevendaalsesteeg 10, Wageningen, 6708 PB, Netherlands, University of Cambridge, Department of Zoology, Downing street, Cambridge, CB2 3EJ, United Kingdom; Tsopoglou-Gkina, D., Utrecht University, Ecology and Biodiversity Group, Department of Biology, Padualaan 8, Utrecht, 3584 CH, Netherlands; Woud, T.Y., Utrecht University, Ecology and Biodiversity Group, Department of Biology, Padualaan 8, Utrecht, 3584 CH, Netherlands; Boonstra, D.K., Utrecht University, Ecology and Biodiversity Group, Department of Biology, Padualaan 8, Utrecht, 3584 CH, Netherlands; Nolet, B.A., Netherlands Institute of Ecology (NIOO-KNAW), Department of Animal Ecology, Droevendaalsesteeg 10, Wageningen, 6708 PB, Netherlands, University of Amsterdam, Theoretical and Computational Ecology, Institute for Biodiversity and Ecosystem Dynamics, Amsterdam, Netherlands; Soons, M.B., Utrecht University, Ecology and Biodiversity Group, Department of Biology, Padualaan 8, Utrecht, 3584 CH, Netherlands, Netherlands Institute of Ecology (NIOO-KNAW), Department of Animal Ecology, Droevendaalsesteeg 10, Wageningen, 6708 PB, Netherlands","Kleyheeg, E.; Utrecht University, Padualaan 8, Netherlands; email: erikkleyheeg@gmail.com", ,105,Netherlands,Europe_Central_Asia,High,Netherlands,,Y,,Netherlands,Europe_Central_Asia,High,,,,,,,,,Nilanjan Chatterjee
"Wright B.M., Ford J.K.B., Ellis G.M., Deecke V.B., Shapiro A.D., Battaile B.C., Trites A.W.",Fine-scale foraging movements by fish-eating killer whales (Orcinus orca) relate to the vertical distributions and escape responses of salmonid prey (Oncorhynchus spp.),2017,10.1186/s40462-017-0094-0,https://www.scopus.com/inward/record.uri?eid=2-s2.0-85013270541&doi=10.1186%2fs40462-017-0094-0&partnerID=40&md5=c09426b1b4d0bbf874c3f886710725a2,"University of British Columbia, Marine Mammal Research Unit, Institute for the Oceans and Fisheries, AERL Building, Room 247 - 2202 Main Mall, Vancouver, BC  V6T 1Z4, Canada; University of British Columbia, Department of Zoology, #4200 - 6270 University Blvd., Vancouver, BC  V6T 1Z4, Canada; Pacific Biological Station, Fisheries and Oceans Canada, 3190 Hammond Bay Road, Nanaimo, BC  V9T 1K6, Canada; University of Cumbria, Centre for Wildlife Conservation, Rydal Road, Ambleside, Cumbria, L22 9BB, United Kingdom; Woods Hole Oceanographic Institution, 266 Woods Hole Road, Woods Hole, MA  02543-1050, United States","Wright, B.M., University of British Columbia, Marine Mammal Research Unit, Institute for the Oceans and Fisheries, AERL Building, Room 247 - 2202 Main Mall, Vancouver, BC  V6T 1Z4, Canada, University of British Columbia, Department of Zoology, #4200 - 6270 University Blvd., Vancouver, BC  V6T 1Z4, Canada, Pacific Biological Station, Fisheries and Oceans Canada, 3190 Hammond Bay Road, Nanaimo, BC  V9T 1K6, Canada; Ford, J.K.B., University of British Columbia, Department of Zoology, #4200 - 6270 University Blvd., Vancouver, BC  V6T 1Z4, Canada, Pacific Biological Station, Fisheries and Oceans Canada, 3190 Hammond Bay Road, Nanaimo, BC  V9T 1K6, Canada; Ellis, G.M., Pacific Biological Station, Fisheries and Oceans Canada, 3190 Hammond Bay Road, Nanaimo, BC  V9T 1K6, Canada; Deecke, V.B., University of Cumbria, Centre for Wildlife Conservation, Rydal Road, Ambleside, Cumbria, L22 9BB, United Kingdom; Shapiro, A.D., Woods Hole Oceanographic Institution, 266 Woods Hole Road, Woods Hole, MA  02543-1050, United States; Battaile, B.C., University of British Columbia, Marine Mammal Research Unit, Institute for the Oceans and Fisheries, AERL Building, Room 247 - 2202 Main Mall, Vancouver, BC  V6T 1Z4, Canada, University of British Columbia, Department of Zoology, #4200 - 6270 University Blvd., Vancouver, BC  V6T 1Z4, Canada; Trites, A.W., University of British Columbia, Marine Mammal Research Unit, Institute for the Oceans and Fisheries, AERL Building, Room 247 - 2202 Main Mall, Vancouver, BC  V6T 1Z4, Canada, University of British Columbia, Department of Zoology, #4200 - 6270 University Blvd., Vancouver, BC  V6T 1Z4, Canada","Wright, B.M.; University of British Columbia, AERL Building, Room 247 - 2202 Main Mall, Canada; email: brianna.wright@dfo-mpo.gc.ca", ,106,Canada,North_America,High,Canada,,Y,,Canada,North_America,High,,,,,,,,,Nilanjan Chatterjee
