"Dickinson E.R., Twining J.P., Wilson R., Stephens P.A., Westander J., Marks N., Scantlebury D.M.",Limitations of using surrogates for behaviour classification of accelerometer data: refining methods using random forest models in Caprids,2021,10.1186/s40462-021-00265-7,https://www.scopus.com/inward/record.uri?eid=2-s2.0-85107598644&doi=10.1186%2fs40462-021-00265-7&partnerID=40&md5=b26cabf6ce66b4edce5023376c34159b,"School of Biological Sciences, Institute for Global Food Security, Queen’s University Belfast, 19 Chlorine Gardens, Belfast, BT9 5DL, United Kingdom; Biosciences, College of Science, Swansea University, Singleton Park, Swansea, Wales, SA2 8PP, United Kingdom; Conservation Ecology Group, Department of Biosciences, Durham University, South Road, Durham, DH1 3LE, United Kingdom; Kolmården Wildlife Park, Kolmården, SE-618 92, Sweden; Öknaskolans Naturbruksgymnasium, Tystberga, SE-611 99, Sweden","Dickinson, E.R., School of Biological Sciences, Institute for Global Food Security, Queen’s University Belfast, 19 Chlorine Gardens, Belfast, BT9 5DL, United Kingdom; Twining, J.P., School of Biological Sciences, Institute for Global Food Security, Queen’s University Belfast, 19 Chlorine Gardens, Belfast, BT9 5DL, United Kingdom; Wilson, R., Biosciences, College of Science, Swansea University, Singleton Park, Swansea, Wales, SA2 8PP, United Kingdom; Stephens, P.A., Conservation Ecology Group, Department of Biosciences, Durham University, South Road, Durham, DH1 3LE, United Kingdom; Westander, J., Kolmården Wildlife Park, Kolmården, SE-618 92, Sweden, Öknaskolans Naturbruksgymnasium, Tystberga, SE-611 99, Sweden; Marks, N., School of Biological Sciences, Institute for Global Food Security, Queen’s University Belfast, 19 Chlorine Gardens, Belfast, BT9 5DL, United Kingdom; Scantlebury, D.M., School of Biological Sciences, Institute for Global Food Security, Queen’s University Belfast, 19 Chlorine Gardens, Belfast, BT9 5DL, United Kingdom","Dickinson, E.R.; School of Biological Sciences, 19 Chlorine Gardens, United Kingdom; email: Dickinson.er@gmail.com", ,276,United Kingdom,Europe_Central_Asia,High,United Kingdom,,N,captive animals,,,,,,,,,,,,Mitchell Serota
"Buderman F.E., Gingery T.M., Diefenbach D.R., Gigliotti L.C., Begley-Miller D., McDill M.M., Wallingford B.D., Rosenberry C.S., Drohan P.J.",Caution is warranted when using animal space-use and movement to infer behavioral states,2021,10.1186/s40462-021-00264-8,https://www.scopus.com/inward/record.uri?eid=2-s2.0-85107627965&doi=10.1186%2fs40462-021-00264-8&partnerID=40&md5=19d072cc26e04d8631c10a803ad9a50e,"Department of Ecosystem Science and Management, Pennsylvania State University, University Park, PA  16802, United States; Pennsylvania Cooperative Fish and Wildlife Research Unit, Pennsylvania State University, University Park, PA  16802, United States; U. S. Geological Survey, Pennsylvania Cooperative Fish and Wildlife Research Unit, Pennsylvania State University, University Park, PA  16802, United States; Department of Environmental Science, Policy, and Management, University of California Berkeley, Berkeley, CA  94720, United States; Teatown Lake Reservation, Ossining, NY  10562, United States; Pennsylvania Game Commission, Harrisburg, PA  17110, United States","Buderman, F.E., Department of Ecosystem Science and Management, Pennsylvania State University, University Park, PA  16802, United States; Gingery, T.M., Pennsylvania Cooperative Fish and Wildlife Research Unit, Pennsylvania State University, University Park, PA  16802, United States; Diefenbach, D.R., U. S. Geological Survey, Pennsylvania Cooperative Fish and Wildlife Research Unit, Pennsylvania State University, University Park, PA  16802, United States; Gigliotti, L.C., Department of Environmental Science, Policy, and Management, University of California Berkeley, Berkeley, CA  94720, United States; Begley-Miller, D., Teatown Lake Reservation, Ossining, NY  10562, United States; McDill, M.M., Department of Ecosystem Science and Management, Pennsylvania State University, University Park, PA  16802, United States; Wallingford, B.D., Pennsylvania Game Commission, Harrisburg, PA  17110, United States; Rosenberry, C.S., Pennsylvania Game Commission, Harrisburg, PA  17110, United States; Drohan, P.J., Department of Ecosystem Science and Management, Pennsylvania State University, University Park, PA  16802, United States","Buderman, F.E.; Department of Ecosystem Science and Management, United States; email: fbuderman@psu.edu", ,277,United States,North_America,High,United States,,Y,,United States,North_America,High,,,,,,,,,Mitchell Serota
"Benitez-Paez F., Brum-Bastos V.S., Beggan C.D., Long J.A., Demšar U.",Fusion of wildlife tracking and satellite geomagnetic data for the study of animal migration,2021,10.1186/s40462-021-00268-4,https://www.scopus.com/inward/record.uri?eid=2-s2.0-85107751437&doi=10.1186%2fs40462-021-00268-4&partnerID=40&md5=44ed76512b463f61a9e22c114759dcac,"School of Geography and Sustainable Development, Irvine Building, University of St Andrews, North Street, St Andrews, KY16 9AL, United Kingdom; The Alan Turing Institute British Library, London, United Kingdom; British Geological Survey, Research Ave South, Riccarton, Edinburgh, United Kingdom; Department of Geography and Environment, Western University, London, ON, Canada","Benitez-Paez, F., School of Geography and Sustainable Development, Irvine Building, University of St Andrews, North Street, St Andrews, KY16 9AL, United Kingdom, The Alan Turing Institute British Library, London, United Kingdom; Brum-Bastos, V.S., School of Geography and Sustainable Development, Irvine Building, University of St Andrews, North Street, St Andrews, KY16 9AL, United Kingdom; Beggan, C.D., British Geological Survey, Research Ave South, Riccarton, Edinburgh, United Kingdom; Long, J.A., School of Geography and Sustainable Development, Irvine Building, University of St Andrews, North Street, St Andrews, KY16 9AL, United Kingdom, Department of Geography and Environment, Western University, London, ON, Canada; Demšar, U., School of Geography and Sustainable Development, Irvine Building, University of St Andrews, North Street, St Andrews, KY16 9AL, United Kingdom","Demšar, U.; School of Geography and Sustainable Development, North Street, United Kingdom; email: urska.demsar@st-andrews.ac.uk", ,278,United Kingdom,Europe_Central_Asia,High,United Kingdom,,N,methods paper,,,,,,,,,,,,Mitchell Serota
"Galtbalt B., Lilleyman A., Coleman J.T., Cheng C., Ma Z., Rogers D.I., Woodworth B.K., Fuller R.A., Garnett S.T., Klaassen M.",Far eastern curlew and whimbrel prefer flying low - wind support and good visibility appear only secondary factors in determining migratory flight altitude,2021,10.1186/s40462-021-00267-5,https://www.scopus.com/inward/record.uri?eid=2-s2.0-85107830561&doi=10.1186%2fs40462-021-00267-5&partnerID=40&md5=708269e1910c15a9029a7070cdd544fb,"Centre for Integrative Ecology, School of Life and Environmental Science, Deakin University, Geelong, VIC, Australia; Threatened Species Recovery Hub, National Environment Science Program, Research Institute for Environment and Livelihoods, Charles Darwin University, Ellengowan Drive, Casuarina, NT  0909, Australia; Queensland Wader Study Group, 22 Parker Street, Shailer Park, 4128, Australia; Ministry of Education Key Laboratory for Biodiversity Science and Ecological Engineering, Coastal Ecosystems Research Station of the Yangtze River Estuary, Institute of Biodiversity Science, School of Life Sciences, Fudan University, Shanghai, 200433, China; Department of Environment, Water, Land and Planning, Arthur Rylah Institute, PO Box 137, Heidelberg, VIC  3084, Australia; Australasian Wader Studies Group, Melbourne, VIC, Australia; School of Biological Sciences, University of Queensland, Brisbane, QLD, Australia; Victorian Wader Study Group, Melbourne, VIC, Australia","Galtbalt, B., Centre for Integrative Ecology, School of Life and Environmental Science, Deakin University, Geelong, VIC, Australia; Lilleyman, A., Threatened Species Recovery Hub, National Environment Science Program, Research Institute for Environment and Livelihoods, Charles Darwin University, Ellengowan Drive, Casuarina, NT  0909, Australia; Coleman, J.T., Queensland Wader Study Group, 22 Parker Street, Shailer Park, 4128, Australia; Cheng, C., Ministry of Education Key Laboratory for Biodiversity Science and Ecological Engineering, Coastal Ecosystems Research Station of the Yangtze River Estuary, Institute of Biodiversity Science, School of Life Sciences, Fudan University, Shanghai, 200433, China; Ma, Z., Ministry of Education Key Laboratory for Biodiversity Science and Ecological Engineering, Coastal Ecosystems Research Station of the Yangtze River Estuary, Institute of Biodiversity Science, School of Life Sciences, Fudan University, Shanghai, 200433, China; Rogers, D.I., Department of Environment, Water, Land and Planning, Arthur Rylah Institute, PO Box 137, Heidelberg, VIC  3084, Australia, Australasian Wader Studies Group, Melbourne, VIC, Australia; Woodworth, B.K., School of Biological Sciences, University of Queensland, Brisbane, QLD, Australia; Fuller, R.A., School of Biological Sciences, University of Queensland, Brisbane, QLD, Australia; Garnett, S.T., Threatened Species Recovery Hub, National Environment Science Program, Research Institute for Environment and Livelihoods, Charles Darwin University, Ellengowan Drive, Casuarina, NT  0909, Australia; Klaassen, M., Centre for Integrative Ecology, School of Life and Environmental Science, Deakin University, Geelong, VIC, Australia, Victorian Wader Study Group, Melbourne, VIC, Australia","Galtbalt, B.; Centre for Integrative Ecology, Australia; email: batbr19@gmail.com", ,279,Australia,East_Asia_Pacific,High,Australia,,Y,,Australia,East_Asia_Pacific,High,,,,,,,,,Mitchell Serota
"Eisaguirre J.M., Williams P.J., Lu X., Kissling M.L., Beatty W.S., Esslinger G.G., Womble J.N., Hooten M.B.",Diffusion modeling reveals effects of multiple release sites and human activity on a recolonizing apex predator,2021,10.1186/s40462-021-00270-w,https://www.scopus.com/inward/record.uri?eid=2-s2.0-85109016340&doi=10.1186%2fs40462-021-00270-w&partnerID=40&md5=eab94618dd2cb0f6fa2be800e9e726ad,"Department of Natural Resources and Environmental Science, University of Nevada Reno, Reno, NV, United States; United States Fish & Wildlife Service, Marine Mammals Management, Anchorage, AK, United States; Department of Statistics, Colorado State University, Fort Collins, CO, United States; U.S. Geological Survey, Alaska Science Center, Anchorage, AK, United States; Southeast Alaska Inventory and Monitoring Network, National Park Service, Juneau, AK, United States; Glacier Bay Field Station, National Park Service, Juneau, AK, United States; Colorado Cooperative Fish and Wildlife Research Unit, U.S. Geological Survey, Department of Fish, Wildlife, and Conservation Biology, Colorado State University, Fort Collins, CO, United States; Present address: Wildlife Biology Program, Department of Ecosystem and Conservation Sciences, W.A. Franke College of Forestry and Conservation, University of Montana, Missoula, MT, United States; Present address: U.S. Geological Survey, Upper Midwest Environmental Sciences Center, La Crosse, WI, United States","Eisaguirre, J.M., Department of Natural Resources and Environmental Science, University of Nevada Reno, Reno, NV, United States, United States Fish & Wildlife Service, Marine Mammals Management, Anchorage, AK, United States; Williams, P.J., Department of Natural Resources and Environmental Science, University of Nevada Reno, Reno, NV, United States; Lu, X., Department of Statistics, Colorado State University, Fort Collins, CO, United States; Kissling, M.L., United States Fish & Wildlife Service, Marine Mammals Management, Anchorage, AK, United States, Present address: Wildlife Biology Program, Department of Ecosystem and Conservation Sciences, W.A. Franke College of Forestry and Conservation, University of Montana, Missoula, MT, United States; Beatty, W.S., United States Fish & Wildlife Service, Marine Mammals Management, Anchorage, AK, United States, Present address: U.S. Geological Survey, Upper Midwest Environmental Sciences Center, La Crosse, WI, United States; Esslinger, G.G., U.S. Geological Survey, Alaska Science Center, Anchorage, AK, United States; Womble, J.N., Southeast Alaska Inventory and Monitoring Network, National Park Service, Juneau, AK, United States, Glacier Bay Field Station, National Park Service, Juneau, AK, United States; Hooten, M.B., Department of Statistics, Colorado State University, Fort Collins, CO, United States, Colorado Cooperative Fish and Wildlife Research Unit, U.S. Geological Survey, Department of Fish, Wildlife, and Conservation Biology, Colorado State University, Fort Collins, CO, United States","Eisaguirre, J.M.; Department of Natural Resources and Environmental Science, United States; email: joseph_eisaguirre@fws.gov", ,280,United States,North_America,High,United States,,Y,,United States,North_America,High,,,,,,,,,Mitchell Serota
"Papageorgiou D., Rozen-Rechels D., Nyaguthii B., Farine D.R.",Seasonality impacts collective movements in a wild group-living bird,2021,10.1186/s40462-021-00271-9,https://www.scopus.com/inward/record.uri?eid=2-s2.0-85109609946&doi=10.1186%2fs40462-021-00271-9&partnerID=40&md5=6f20aa5a0ff7bcf4565d24f2978c0d61,"Department of Collective Behavior, Max Planck Institute of Animal Behavior, Universitätsstraße 10, Constance, 78457, Germany; Department of Biology, University of Konstanz, Universitätsstraße 10, Constance, 78457, Germany; Center for the Advanced Study of Collective Behaviour, University of Konstanz, Universitätsstraße 10, Constance, 78457, Germany; Department of Evolutionary Biology and Environmental Studies, University of Zurich, Winterthurerstrasse 190, Zurich, 8057, Switzerland; Kenya Wildlife Service, P.O. Box 40241-001000, Nairobi, Kenya; School of Natural Resource Management, Department of Wildlife, University of Eldoret, Eldoret, 1125-30100, Kenya; Mpala Research Center, P.O. Box 92, Nanyuki, 10400, Kenya; Department of Ornithology, National Museums of Kenya, P.O. Box 40658-001000, Nairobi, Kenya","Papageorgiou, D., Department of Collective Behavior, Max Planck Institute of Animal Behavior, Universitätsstraße 10, Constance, 78457, Germany, Department of Biology, University of Konstanz, Universitätsstraße 10, Constance, 78457, Germany, Center for the Advanced Study of Collective Behaviour, University of Konstanz, Universitätsstraße 10, Constance, 78457, Germany, Department of Evolutionary Biology and Environmental Studies, University of Zurich, Winterthurerstrasse 190, Zurich, 8057, Switzerland, Kenya Wildlife Service, P.O. Box 40241-001000, Nairobi, Kenya; Rozen-Rechels, D., Department of Collective Behavior, Max Planck Institute of Animal Behavior, Universitätsstraße 10, Constance, 78457, Germany, Department of Biology, University of Konstanz, Universitätsstraße 10, Constance, 78457, Germany, Center for the Advanced Study of Collective Behaviour, University of Konstanz, Universitätsstraße 10, Constance, 78457, Germany, Department of Evolutionary Biology and Environmental Studies, University of Zurich, Winterthurerstrasse 190, Zurich, 8057, Switzerland; Nyaguthii, B., School of Natural Resource Management, Department of Wildlife, University of Eldoret, Eldoret, 1125-30100, Kenya, Mpala Research Center, P.O. Box 92, Nanyuki, 10400, Kenya, Department of Ornithology, National Museums of Kenya, P.O. Box 40658-001000, Nairobi, Kenya; Farine, D.R., Department of Collective Behavior, Max Planck Institute of Animal Behavior, Universitätsstraße 10, Constance, 78457, Germany, Center for the Advanced Study of Collective Behaviour, University of Konstanz, Universitätsstraße 10, Constance, 78457, Germany, Department of Evolutionary Biology and Environmental Studies, University of Zurich, Winterthurerstrasse 190, Zurich, 8057, Switzerland, Department of Ornithology, National Museums of Kenya, P.O. Box 40658-001000, Nairobi, Kenya","Papageorgiou, D.; Kenya Wildlife Service, P.O. Box 40241-001000, Kenya; email: dpapageorgiou@ab.mpg.de
Farine, D.R.; Department of Ornithology, P.O. Box 40658-001000, Kenya; email: damien.farine@ieu.uzh.ch", ,281,Germany,Europe_Central_Asia,High,Kenya,,Y,,Kenya,Sub-Saharan_Africa,Lower_Middle,,,,,,,,,Mitchell Serota
"Smetzer J.R., Paxton K.L., Paxton E.H.",Individual and seasonal variation in the movement behavior of two tropical nectarivorous birds,2021,10.1186/s40462-021-00275-5,https://www.scopus.com/inward/record.uri?eid=2-s2.0-85109651591&doi=10.1186%2fs40462-021-00275-5&partnerID=40&md5=1cd030ee21e128d3f6b2a487734117c2,"Hawaiʻi Cooperative Studies Unit, University of Hawaiʻi at Hilo, PO Box 44, Hawai‘i National Park, HI  96718, United States; U.S. Geological Survey Pacific Island Ecosystems Research Center, PO Box 44, Hawai‘i National Park, HI  96718, United States","Smetzer, J.R., Hawaiʻi Cooperative Studies Unit, University of Hawaiʻi at Hilo, PO Box 44, Hawai‘i National Park, HI  96718, United States; Paxton, K.L., Hawaiʻi Cooperative Studies Unit, University of Hawaiʻi at Hilo, PO Box 44, Hawai‘i National Park, HI  96718, United States; Paxton, E.H., U.S. Geological Survey Pacific Island Ecosystems Research Center, PO Box 44, Hawai‘i National Park, HI  96718, United States","Smetzer, J.R.; Hawaiʻi Cooperative Studies Unit, PO Box 44, United States; email: smetzer180@gmail.com", ,282,United States,North_America,High,United States,,Y,,United States,North_America,High,,,,,,,,,Mitchell Serota
"Mallon J.M., Bildstein K.L., Fagan W.F.",Inclement weather forces stopovers and prevents migratory progress for obligate soaring migrants,2021,10.1186/s40462-021-00274-6,https://www.scopus.com/inward/record.uri?eid=2-s2.0-85109670873&doi=10.1186%2fs40462-021-00274-6&partnerID=40&md5=b1530c78ba790a54a8886bf088c6f70e,"Department of Biology, University of Maryland, College Park, MD  20742, United States; Hawk Mountain Sanctuary, Acopian Center for Conservation Learning, 410 Summer Valley Road, Orwigsburg, PA  17961, United States","Mallon, J.M., Department of Biology, University of Maryland, College Park, MD  20742, United States; Bildstein, K.L., Hawk Mountain Sanctuary, Acopian Center for Conservation Learning, 410 Summer Valley Road, Orwigsburg, PA  17961, United States; Fagan, W.F., Department of Biology, University of Maryland, College Park, MD  20742, United States","Mallon, J.M.; Department of Biology, United States; email: jmmallon@umd.edu", ,283,United States,North_America,High,United States,,Y,,United States,North_America,High,,,,,,,,,Mitchell Serota
"Kerches-Rogeri P., Ramos D.L., Siren J., de Oliveira Teles B., Alves R.S.C., Priante C.F., Ribeiro M.C., Araújo M.S., Ovaskainen O.",Movement syndromes of a Neotropical frugivorous bat inhabiting heterogeneous landscapes in Brazil,2021,10.1186/s40462-021-00266-6,https://www.scopus.com/inward/record.uri?eid=2-s2.0-85109771889&doi=10.1186%2fs40462-021-00266-6&partnerID=40&md5=5952439ea7b6ad730da96a8435eab3e3,"Departamento de Biodiversidade, Universidade Estadual Paulista – UNESP, Avenida 24 A,1515, Rio Claro, São Paulo, Brazil; Faculty of Biological and Environmental Sciences, University of Helsinki, P.O. Box 65, Viikinkaari 1, Helsinki, 00014, Finland; Department of Computer Science, Aalto University, Espoo, Finland; Centre for Biodiversity Dynamics, Department of Biology, Norwegian University of Science and Technology, Trondheim, N-7491, Norway","Kerches-Rogeri, P., Departamento de Biodiversidade, Universidade Estadual Paulista – UNESP, Avenida 24 A,1515, Rio Claro, São Paulo, Brazil; Ramos, D.L., Departamento de Biodiversidade, Universidade Estadual Paulista – UNESP, Avenida 24 A,1515, Rio Claro, São Paulo, Brazil; Siren, J., Faculty of Biological and Environmental Sciences, University of Helsinki, P.O. Box 65, Viikinkaari 1, Helsinki, 00014, Finland, Department of Computer Science, Aalto University, Espoo, Finland; de Oliveira Teles, B., Departamento de Biodiversidade, Universidade Estadual Paulista – UNESP, Avenida 24 A,1515, Rio Claro, São Paulo, Brazil; Alves, R.S.C., Departamento de Biodiversidade, Universidade Estadual Paulista – UNESP, Avenida 24 A,1515, Rio Claro, São Paulo, Brazil; Priante, C.F., Departamento de Biodiversidade, Universidade Estadual Paulista – UNESP, Avenida 24 A,1515, Rio Claro, São Paulo, Brazil; Ribeiro, M.C., Departamento de Biodiversidade, Universidade Estadual Paulista – UNESP, Avenida 24 A,1515, Rio Claro, São Paulo, Brazil; Araújo, M.S., Departamento de Biodiversidade, Universidade Estadual Paulista – UNESP, Avenida 24 A,1515, Rio Claro, São Paulo, Brazil; Ovaskainen, O., Faculty of Biological and Environmental Sciences, University of Helsinki, P.O. Box 65, Viikinkaari 1, Helsinki, 00014, Finland, Centre for Biodiversity Dynamics, Department of Biology, Norwegian University of Science and Technology, Trondheim, N-7491, Norway","Kerches-Rogeri, P.; Departamento de Biodiversidade, Avenida 24 A,1515, Rio Claro, Brazil; email: parogeri@gmail.com", ,284,Brazil,Latin_America_Caribbean,Upper_Middle,Brazil,,Y,,Brazil,Latin_America_Caribbean,Upper_Middle,,,,,,,,,Julie Kellner
"Vansteelant W.M.G., Gangoso L., Bouten W., Viana D.S., Figuerola J.",Adaptive drift and barrier-avoidance by a fly-forage migrant along a climate-driven flyway,2021,10.1186/s40462-021-00272-8,https://www.scopus.com/inward/record.uri?eid=2-s2.0-85110620469&doi=10.1186%2fs40462-021-00272-8&partnerID=40&md5=d9ad4295f34ecc4f11cf2ccc748ac4b1,"Estación Biológica de Doñana, CSIC. Cartuja TA-10, Edificio I, Calle Américo Vespucio, s/n, Sevilla, 41092, Spain; Institute for Biodiversity and Ecosystem Dynamics (IBED), University of Amsterdam, Sciencepark 904, Amsterdam, 1098 XH, Netherlands; Department of Biodiversity, Ecology and Evolution. Faculty of Biology, Complutense University of Madrid, C/ José Antonio Novais 2, Madrid, 28040, Spain; German Center for Integrative Biodiversity Research (iDiv), Deutscher Platz 5e, Halle-Jena-Leipzig, Leipzig, Germany","Vansteelant, W.M.G., Estación Biológica de Doñana, CSIC. Cartuja TA-10, Edificio I, Calle Américo Vespucio, s/n, Sevilla, 41092, Spain, Institute for Biodiversity and Ecosystem Dynamics (IBED), University of Amsterdam, Sciencepark 904, Amsterdam, 1098 XH, Netherlands; Gangoso, L., Estación Biológica de Doñana, CSIC. Cartuja TA-10, Edificio I, Calle Américo Vespucio, s/n, Sevilla, 41092, Spain, Department of Biodiversity, Ecology and Evolution. Faculty of Biology, Complutense University of Madrid, C/ José Antonio Novais 2, Madrid, 28040, Spain; Bouten, W., Institute for Biodiversity and Ecosystem Dynamics (IBED), University of Amsterdam, Sciencepark 904, Amsterdam, 1098 XH, Netherlands; Viana, D.S., German Center for Integrative Biodiversity Research (iDiv), Deutscher Platz 5e, Halle-Jena-Leipzig, Leipzig, Germany; Figuerola, J., Estación Biológica de Doñana, CSIC. Cartuja TA-10, Edificio I, Calle Américo Vespucio, s/n, Sevilla, 41092, Spain","Vansteelant, W.M.G.; Institute for Biodiversity and Ecosystem Dynamics (IBED), Sciencepark 904, Netherlands; email: wouter.vansteelant@ebd.csic.es", ,285,Spain,Europe_Central_Asia,High,Netherlands,,Y,,Spain,Europe_Central_Asia,High,,,,,,,,,Mitchell Serota
